,Contents,Datetime,Title
0,"["" A trove of documents known as the Paradise Papers have reportedly shed light on Apple's search for a new place to store the huge sums, after more than two decades of benefiting from artificially low taxes in Ireland. The company has resisted bringing the money back to the U.S. because of the massive tax bill it would face. "", ' Coverage of the documents is being coordinated by the International Consortium of Investigative Journalists, which has shared them with major media outlets including The New York Times, The Guardian and the BBC. ', "" CNN hasn't independently reviewed the documents. "", ' Related: What you need to know about the Paradise Papers ', ' Apple (AAPL, Tech30) for years funneled most of its overseas profits through Ireland. Arrangements with the Irish government allowed Apple to pay a tax rate of just 0.005% in 2014 on the money it made selling its products to most of the world outside America, according to the European Commission. ', "" The ICIJ reports that the maker of the iPhone and iPad began hunting for a new jurisdiction to hold overseas profits after Ireland in 2014 came under pressure from the European Commission to close tax loopholes that allow companies to lower their tax below Ireland's 12.5% rate. "", "" Apple eventually opted for Jersey, a British Crown Dependency off the coast of France that doesn't usually charge tax on foreign companies' profits and mostly falls outside of EU jurisdiction. Jersey also has strong links to the U.K. banking system. "", "" The ICIJ reported that the documents in the Paradise Papers suggest Apple didn't want word of the Jersey move to get out. "", ' ', ' Apple, which currently has $252 billion of its cash outside the U.S., said in a statement Monday that it adjusted its corporate structure when Ireland changed its tax laws in 2015. ', ' ""As part of these changes, Apple\'s subsidiary which holds overseas cash became resident in the U.K. Crown dependency of Jersey, specifically to ensure that tax obligations and payments to the U.S. were not reduced,"" the company said. ', ' Related: Why big American companies stash cash overseas ', ' ""Since then Apple has paid billions of dollars in U.S. tax on the investment income of this subsidiary,"" it added. ""There was no tax benefit for Apple from this change and, importantly, this did not reduce Apple\'s tax payments or tax liability in any country."" ', ' The company said it ""pays every dollar it owes in every country around the world,"" including tax in the U.S. at the standard rate of 35% and an effective rate of 21% on foreign earnings. ', ' ""This rate has been consistent for many years,"" it added. ', "" Related: These are the world's worst tax havens  "", "" Apple CEO Tim Cook was forced to defend Apple's tax practices in testimony to the U.S. Senate in 2013. "", "" There's no indication Apple has done anything illegal. The company didn't immediately respond to requests for further comment on its international tax arrangements. "", ' ', "" Apple isn't the only global tech firm to run international operations out of Ireland. Google (GOOGL, Tech30) also has its European HQ in the country. "", "" The European Union is currently trying to force Ireland to collect £á13 billion ($15 billion) in unpaid taxes from Apple. The European Commission -- the EU's executive arm whose remit includes antitrust cases -- ruled last year that the Irish government had granted illegal aid to Apple by helping it keep its tax bill artificially low for more than 20 years. "", ' The Irish government said last month that while it has ""never accepted the Commission\'s analysis"" in the Apple case, it was working to recover the taxes. ', ' Cook has said the Commission\'s ruling has ""no basis in fact or in law,"" calling it ""obvious targeting of Apple."" ', "" The Paradise Papers disclosures come as President Trump's administration seeks to overhaul the U.S. federal tax code. "", ' Under the House GOP tax bill, the main federal tax rate would be 20%, not 35%, and overseas profits would no longer be subject to U.S. tax. Instead they would be taxed by the country where the money is made. ']"," November 7, 2017: 7:56 AM ET ",Apple defends use of new tax haven after Ireland got tough
1,"[' The ridesharing company announced the effort on Monday on the heels of sexual harassment and assault reports hitting Hollywood, media and the tech industry. ', ' The funds, which will be distributed over the course of five years, will go to various groups, including Raliance, the National Network to End Domestic Violence and NO MORE. In 2016, the National Football League donated $10 million to Raliance amid domestic abuse scandals impacting its industry. ', ' The organizations have been in talks with Uber since June, the company said. ', "" Uber's team of 150 customer service agents have taken new trainings for handling calls related to harassment issues. "", ' Tracey Breeden, head of global safety communications at Uber, told CNN Tech the ability to respond with empathy to calls from drivers or riders that pertain to issues as sensitive as sexual violence is ""critically important."" Uber has also created a new specialized team to handle ""more severe"" incidents reported by drivers or riders. ', "" Meanwhile, Uber's executive leadership team participated in trainings last week facilitated by the National Alliance to End Sexual Violence and the National Network to End Domestic Violence, Breeden said. "", "" Related: What we know (and don't know) about Uber background checks "", "" Raliance spokeswoman Kristen Houser said it's a rare move for big firms to recognize sexual violence prevention. "", ' ""[Uber is] no different than the NFL or any other company that has a wakeup or realization about how seriously things can impact people\'s lives and your business,"" said Houser. ', ' Houser said she hopes the latest efforts will bring more attention to the organization: ""We certainly need the help of Corporate America."" ', ' Related: Uber now lets you add multiple stops to your ride ', "" In June, Uber cofounder and CEO Travis Kalanick resigned following an investigation of sexual harassment at the workplace. In August, Uber tapped Expedia's Dara Khosrowshahi as its new CEO. "", ' Now, the company continues its attempt at a turnaround story. ', ' Riders and drivers will also receive an in-app push notification on Monday informing them of resources available to help with sexual assault and domestic violence. ', ' ""We hope that people judge us on the changes that we\'ve made to build a better Uber,"" added Breeden. ']"," November 6, 2017: 2:34 PM ET ",Uber pledges $5 million to sexual assault prevention
2,"[' Some Apple (AAPL, Tech30) users have discovered a bug that automatically corrects the lower-case letter ""i"" to ""A"" and a question mark symbol. ', ' The issue appears to impact iPhone users on its most recent mobile software, iOS 11.1. The new software launched last Tuesday and features hundreds of new emoji. ', ' Not surprisingly, the bug is frustrating many Apple users. ', ' ""WHY does my #iphone keep changing the letter ""i"" to I ?! HELP,"" tweeted one user. ', ' ""I had to turn off my auto correct which is super annoying,"" wrote another iPhone user on Apple\'s discussion forum. ', ' ', "" Although Apple hasn't officially updated the software to correct the issue, it suggested on its website a way for users to fix it themselves. Users can access the Keyboard settings and add a text replacement. "", ' ""For Phrase, type an upper-case \'I,\'"" Apple explains. ""For Shortcut, type a lower-case \'i.\'"" ', ' Related: iPhone X review: The future takes getting used to ', ' Apple said in its support post the error will be fixed in a future software update. ', ' The highly anticipated iPhone X hit stores worldwide on Friday. The device, which starts at $999, touts facial recognition technology, an edge-to-edge screen and a powerful camera. ', ' ', "" But some users reportedly had trouble activating their new devices due to issues with mobile carriers' activation servers. "", "" It's not uncommon for new software to have bugs. A previous version of iOS 11 contained an issue with the calculator app and miscalculated the result of 1+2+3. "", ' Apple has not responded to a request for comment. ']"," November 6, 2017: 10:13 PM ET ",iPhone bug frustrates users typing 'i'
3,"["" But as a queer black woman, she found the industry wasn't in her favor. "", ' ""I tried earnestly and with wide eyes,"" Hamilton told CNN Tech. ""But I just got doors slammed in my face. Nobody was interested."" ', ' Hamilton, then 34, also struggled to afford a place to live. Even as she tried to set up meetings with potential partners, she spent nights on the floor of the San Francisco Airport. ', ' Later that year, her first investment came through. She started Backstage Capital, a firm dedicated to funding underrepresented founders who identify as LGBTQ, women and people of color. ', ' Since its launch in 2015, the company said it has invested over $2 million in more than 50 startups. This includes ShearShare, a platform that connects stylists to salons, and Astral AR, an augmented reality piloting system for drones. Its goal is to reach 100 founders by 2020. ', ' Starting her own fund meant facing a system that has not been fair to people of color, especially black women. According to a study by researchers from Babson and Wellesley colleges, female CEOs receive 3% of all VC funding. Meanwhile, black women founders made up only 0.2% of all VC deals between 2012 to 2014, according to #ProjectDiane. The study, which published last year, examined more than 60,000 startups in the U.S. ', ' ""I realized that [access to] opportunities were only for certain people. If anyone else wanted in, they\'d have to create their own access and their own experience,"" Hamilton said. ', ' ""I said, \'I could not do this, but then I won\'t see any change. If they wont let me in, I\'ll start my own league.\'"" ', ' Backstage Capital has since attracted support from Slack CEO Stewart Butterfield and Marc Andreessen, an investor in Twitter, Skype and Facebook. ', "" Related: Tech's diversity efforts are 'a failure' "", ' Starting her ""own league"" wasn\'t and still isn\'t easy. The few black women founders who receive VC funding get significantly less of the pie. The average amount of money for a failed startup raises $1.3 million, but the average black female founder received $36,000, the #ProjectDiane study showed. ', ' Part of the battle is explaining diversity can be good for business, said Hamilton. For example, companies with female founders saw 63% higher returns than companies with all men did, one study showed. ', ' ""It\'s not about ""helping"" founders,"" she wrote in a viral Medium post called ""Dear White Venture Capitalists: If you\'re reading this, it\'s (almost!) too late"". ""It\'s about fueling an untapped ecosystem so that you may be lucky enough to reap the rewards in years to come."" ', "" Hamilton said she's still optimistic about the future. "", ' ""We\'ve been uncomfortable our whole lives and the generations before us,"" she said. ""It\'s okay to make others uncomfortable [sometimes]. I\'ve been dancing on the boat for years, and I\'m still here."" ']"," November 6, 2017: 3:55 PM ET ","Black, queer and female: VC founder starts her 'own league'"
4,"[' Instead, the body of the Lamborghini Terzo Millennio concept car, made from exotic carbon nanotubes, would be used as a supercapacitor. Supercapacitors store and release energy in a manner different from that employed by batteries. They have certain advantages, but also serious disadvantages. ', "" It could be years, if ever, before scientists from MIT and Lamborghini, which is part of the Volkswagen Group (VLKAF), can overcome the downsides. But the effort would be worth it, said Mauricio Reggiani, Lamborghini's head of research and development. "", ' ""At the moment, we are really optimistic,"" he said. ', "" Even the best batteries won't work in a supercar, Reggiani said, because they're too heavy and bulky. If the car used only small batteries, so as not to add too much mass, he said, they would get drained quickly and wouldn't provide peak performance for very long. "", ' ""If I have a super sports car and I want to go the [race track], I want to go one, two, three laps without having to stop and recharge after every lap,"" he said. ', "" Supercapacitors, which can be made from carbon, have the flexibility to be formed into body panels, which the car needs anyway, thereby limiting their impact on the car's weight and design. "", ' Supercapacitors also take in and release energy much more quickly than batteries which is helpful in a performance car. Batteries can get hot, and their performance can suffer, when high-powered electric motors, plus heavy-footed drivers, try to draw too much power from them too quickly. ', "" Supercapicitors have some major drawbacks, though. They aren't very good at storing large amounts of energy long term. Today, supercapacitors are usually used in roles that involve quick, short bursts of energy such as to quickly restart a gasoline engine. Making supercapacitors that are as good at holding energy as they are at doling it out is one of the biggest challenges the scientists are working on, said Reggiani. "", "" Each of the car's four wheels would be independently powered by an electric motor. This would give the car all-wheel-drive, a traditional feature of modern Lamborghinis, while also providing more design freedom, since a big electric motor wouldn't need to be housed in the body of the car. "", ' Another interesting function of the carbon nanotube body, according to Lamborghini, is that it can be made ""self-healing."" Sensors in the body could detect cracks that, provided they were tiny enough, could immediately be filled through small internal tubes. More serious damage would be reported to the driver and to Lamborghini technicians who could make needed repairs. ', ' Besides simply making all of this technology work, the challenge will be making it feasible for a production car, even at Lamborghini prices, Reggiani said. ', ' Automakers of all types are being pressed to reduce emissions and offering all-electric cars would be one way to do that. ', "" In the more distant future, it's conceivable this technology could eventually be used even in more mainstream electric cars. "", ' The car\'s name means ""Third Millennium"" in Italian. Lamborghini hopes to have it all working long before then. ']"," November 6, 2017: 5:02 PM ET ",Lamborghini and MIT team up on battery-free electric supercar 
5,"[' But one city known for the maritime industry is emerging as one of the fast-growing tech scenes outside the U.S. ', "" Oslo, Norway's capital city, experienced a 160% uptick in startup investments in the past year, according to Oslo's 2017 State of the City report. That's the second biggest jump in the Nordic region behind Sweden, up 171%. "", ' ""There\'s a booming startup scene in Oslo,"" said Tellef Thorleifsson, a founding partner of the Norwegian VC Northzone. ""But it\'s still in the early stages."" ', "" Norway is the eighth wealthiest nation in the world due in part to its biggest export: oil. It was recently ranked as the happiest country on Earth by the United Nations 2017 World Happiness Report. The country's sovereign wealth fund just topped $1 trillion dollars last month. "", ' But in recent years, Norway has had to compete with lower oil prices in the Middle East and Venezuela. ', "" Now, its leaders are looking to eco-friendly tech as the next big money maker -- a natural evolution for the country, which has long been committed to sustainability. It's currently one of the only countries to have a tax on carbon emissions, and the government offers a 25% subsidy for fuel efficient vehicles. "", "" Related: Where are the world's happiest countries? "", ' ""If you\'re gonna solve the world\'s biggest issues today, you really need technology and innovation,"" Crown Princess of Norway Mette-Marit told CNN. ', ' Crown Prince Haakon and Crown Princess Mette-Marit are encouraging more entrepreneurs to take advantage of investors interested in funding socially minded startups. ', ' Last year, there were 78 investments in Norwegian tech companies -- totaling $100 million, according to the 2017 State of the City report. About 15% of tech investments in the country were focused on sustainability, the highest among all the Nordic countries, research firm Nordic Web finds. ', ' Other northern European cities such as Denmark and Helsinki have some cache for producing successful tech startups like Spotify and Rovio, maker of Angry Birds. ', ' ""The quality of the entrepreneurs we see [in the country] now compared to 10 years ago is a lot higher, "" said Thorleifsson of Norwegian VC Northzone. ', ' Thorleifsson was an early investor in Spotify and has a diverse portfolio of digital tech companies -- the majority of which are from Scandinavia. Northzone is an investor in the Norwegian company Kahoot!, a game-based learning platform primarily used in schools. It boasts 50 million monthly unique users. ', ' ""There\'s a lot of capital in Oslo and a lot of money going into tech,"" said Kahoot! CEO Erik Harrell. ""I think those elements helped make Oslo a good place to start companies."" ', "" While most of Kahoot!'s users are in the U.S., 85% of their funding is from Scandinavia. "", ' ""We found getting funding in Europe was fairly easy,"" said Harrell. ""The Nordic venture capital community is fairly small so getting access to [VCs] wasn\'t that difficult."" ', "" While Norway's startup scene has a lot of momentum, the country has only produced one unicorn: the blockchain platform, IOTA. Blockchain is a data base for cryptocurrency, which is not regulated by a central governing body and is used heavily in developing countries. "", ' This year alone, Silicon Valley added 44 unicorns. A unicorn is a startup valued at over $1 billion. ', "" But since 2014, Silicon Valley's share of global unicorns has decreased by almost 50%, according to Northzone's analysis of data published in the Wall Street Journal. Meanwhile, the number of unicorns in Asia and Europe has grown significantly -- up 400% and 700%, respectively -- in just three years. "", ' Related: 10 best cities to launch a startup ', ' Martine Kveim of CHOOOSE, a Norwegian-based climate change platform, sees that as an advantage. ', ' ""[Norway] is still much less mature compared to many other parts of the world, which opens up great opportunities for attentive investors,"" said Kveim. ', ' One of those investors was Nordic Impact, a VC firm that invests solely in companies with sustainability-focused business models. It was an early investor in the nearly year-old startup CHOOOSE, which focuses on eliminating the carbon footprint of big businesses. ', ' The company works with the UN Framework Convention on Climate Change and the EU Emissions Trading System to sell carbon emission quotas to the average person and socially-conscious companies. The process of purchasing carbon quotas is typically reserved for big corporations with a large carbon footprint. The move makes the carbon quotas less available for big polluters. ', ' Related: How Norway is changing the way we drink coffee ', ' ""[We\'ve had investor interest] because we\'ve found a good way to connect idealism with green capitalism,"" said Kveim. ""Our experience is that impact investing opportunities attracts people that have a lot more to offer than funding."" ', ' Anders Lier, the chairman of of Nordic Impact, believes there is more money to be made from companies focused on sustainability. ', ' ""[Young people] want to buy good products that are good for the planet, and they\'re willing to pay premium prices for it,"" Lier said. ', ' As startups continue to grow and look for funding, some are attracting attention from outside the country, too. ', ' ""Many investors we\'re [talking to] now are coming from outside of Norway,"" said Kveim of CHOOOSE. ""The vision and mission of the company seems to have no borders."" ']"," November 6, 2017: 8:40 AM ET ",World's happiest country is becoming a startup mecca
